{"verdict":"RESTART_REQUIRED","material_blockers":[{"summary":"The replay/effect-reservation identity-conflict path escapes as raw RuntimeError and retains admitted-source bytes in traceback locals, contradicting the required replay sanitization boundary.","evidence":["packet.md:59-65 requires replay failures to be sanitized and forbids raw sensitive bytes in traceback frames or capture-locals output.","product/src/glupta_agi/workflow.py:99-107 catches only BriefGenerationError and AmbiguousEffectError, while lines 111-124 retain packet, admitted content, and request_body when calling reserve.","product/src/glupta_agi/effects.py:160-200 raises an unconverted RuntimeError when an existing effect conflicts with the recorded input.","A read-only diagnostic through the exact reserve implementation with a valid mismatched synthetic row produced exception_type=builtins.RuntimeError, message='external effect identity conflicts with recorded input', product_frames=[('_run_inference', true), ('_run_inference_sensitive', true), ('reserve', false), ('transaction', false)], and adapter_constructed=false. No credential, network, provider call, or write was used."],"defect_class":"production-code confidentiality and replay-boundary defect","disposition":"Keep dispatch frozen. Convert expected reservation/replay conflicts into a fresh sanitized domain exception outside sensitive frames, add capture-locals regression coverage for the actual reserve-conflict path, freeze new exact identities, and restart review."},{"summary":"Runtime and package versions agree on 0.3.0 but do not resolve from the single source required by the frozen contract.","evidence":["packet.md:77-78 requires runtime, package metadata, API, and DBOS application identity to resolve from one 0.3.0 source.","product/pyproject.toml:7 independently declares version = '0.3.0'; product/src/glupta_agi/__init__.py:2 separately declares __version__ = '0.3.0'.","product/tests/test_release_boundary.py:18-31 checks equality between the two literals and routes API/DBOS through __version__, but equality testing does not make package metadata resolve from that source."],"defect_class":"production/package contract defect and false single-source closure claim","disposition":"Adopt one canonical version source for package metadata, runtime, API, and DBOS identity; retain equality/build regression proof, refreeze the candidate, and restart exact-byte review."}],"non_blocking_findings":["All three supplied top-level SHA-256 hashes matched. All 64 manifest entries matched their exact Git blobs, with no duplicate paths; every base is an ancestor of its candidate, and the candidate worktrees were clean.","R8 correctly adds asyncio.CancelledError handling at both post-client await boundaries, preserves sticky unknown/no-redispatch behavior in its regressions, and corrects the R7 Blueprint identity sentence without rewriting historical receipts.","Provider, account, release, egress, supply-chain, deployment, rollback, dispatch, task-drain, Walk, public, Hermes, outbound, signing, trading, transfer, and money gates remain explicitly held. Their open status was not treated as a blocker or approval."],"factual_corrections":["R8's capture-locals evidence proves the repaired cancellation and enumerated domain-error paths; it does not prove the exact reserve/replay identity-conflict path is sanitized.","The candidate has one currently matching 0.3.0 identity enforced by a test, but two independent version literals rather than one version source."],"foundation_disposition":{"action":"repair","cost":"Two bounded code/package repairs, targeted regression proof, new exact hashes, and a fresh review cycle; no architectural rebuild is indicated.","risk":"A replay conflict can expose selected source content to traceback-local capture, and duplicated version sources can drift package and DBOS recovery identity despite matching on these bytes.","rollback":"R8 is dispatch-held and undeployed, so no operational rollback is required. Preserve these exact bytes as rejected evidence; historical 0.2.10 remains a non-target.","dispatch_held":true},"confidence_and_uncertainty":"High confidence. Mechanical validation covered every supplied hash and manifest entry, and the replay defect was reproduced using synthetic data against the exact production path without writes, credentials, network access, or peer-review results. Write-producing suites and open release gates were not rerun or activated under this read-only audit; neither uncertainty changes the two source-proven blockers."}