{"verdict":"RESTART_REQUIRED","material_blockers":[{"summary":"External task cancellation escapes the public adapter as raw asyncio.CancelledError, leaving credential and admitted-source bytes reachable through traceback-frame locals and bypassing the required ambiguous-transport classification.","evidence":["packet.md:59-65 requires sanitization across public boundaries with no sensitive bytes reachable through traceback frames or capture-locals; packet.md:72-76 requires every unproved transport outcome to become sticky unknown.","product/src/glupta_agi/openai_adapter.py:77-85 catches and sanitizes only AdapterError. The transport and cleanup handlers at lines 110-132 catch Exception, but asyncio.CancelledError inherits directly from BaseException.","A read-only, no-network diagnostic against the exact candidate using synthetic markers produced: exception_type=asyncio.exceptions.CancelledError; cause_is_none=True; context_is_none=True; product_frames=[('generate', ['source']), ('_generate', ['key', 'source'])]. Thus the traceback still retained both synthetic credential and admitted-source values.","product/tests/test_openai_adapter.py:488-519 covers expiration of asyncio.timeout_at, which becomes a handled timeout, but does not cover independent task cancellation that propagates as CancelledError."],"defect_class":"production-code confidentiality and fail-closed transport-boundary defect","disposition":"Keep dispatch frozen. Repair cancellation handling so sensitive scopes are released and a clean boundary exception or equivalently sanitized cancellation preserves correct cancellation semantics, immediately enforces sticky unknown/no redispatch for an unproved transport outcome, and add a capture-locals regression for external cancellation. Freeze new exact identities and restart review."},{"summary":"The normative control amendment contains a false R7 identity-closure statement that contradicts both the packet and the exact Blueprint artifacts.","evidence":["control/docs/glupta/crawl-foundation-amendment-2026-08-18.md:245-257 states that the two Blueprint openings now identify R6 as the then-current candidate.","packet.md:112-119 states that those openings name the exact current R7 candidate.","blueprint/wiki/operations/debates/greenfield-agent-farm-architecture-v3/idea.md:3-5 and blueprint/wiki/operations/stack.md:12-14 both identify exact product commit 61f817ffbe8dcb08626e2ffc10eccf825e048312 as the current R7 review-pending candidate."],"defect_class":"normative control/Blueprint identity inconsistency and false closure claim","disposition":"Correct the R7 control statement to identify R7 as current and R6 as immutable rejected history without rewriting historical receipts; freeze new hashes and restart exact-byte review."}],"non_blocking_findings":["The packet, manifest, and schema hashes matched their supplied SHA-256 values.","All 58 manifest entries matched independently computed Git-blob SHA-256 values, and all three virtual roots resolved to the specified exact commits.","Provider/account, release, egress, SBOM, provenance, rollback, dispatch, deployment, task-drain, Walk, public-activation, broader-Hermes, outbound, signing, trading, transfer, and money-movement gates remain explicitly and effectively held; their open status is not itself a candidate blocker.","No peer-review route was invoked or relied upon; the Codex-first hard gate stopped on the substantiated blockers."],"factual_corrections":["The supplied timeout regression does not prove external task-cancellation sanitization: asyncio.timeout_at handles its own deadline expiry, whereas independent cancellation propagates as BaseException-derived CancelledError.","The control amendment should say the two Blueprint opening statements identify R7 as the current review-pending candidate; they do not identify R6."],"foundation_disposition":{"action":"repair","cost":"A bounded production boundary repair, one control-text correction, deterministic regression verification, new exact candidate hashes, and a fresh review cycle.","risk":"Material if dispatch were enabled: cancellation can expose credential/source bytes through traceback-local capture and leave an unproved transport outcome outside the immediate ambiguity boundary. The control evidence also misstates candidate identity.","rollback":"R7 was not deployed, so no production rollback is required. Preserve these exact R7 bytes as rejected evidence, retain historical 0.2.10 as a non-target, and keep every dispatch and release authority held.","dispatch_held":true},"confidence_and_uncertainty":"High. Top-level hashes, exact commit roots, and every manifest blob were verified. The production defect was reproduced against the exact candidate with synthetic values and no network, credential, or secret access; the documentation contradiction is literal on the reviewed bytes."}