{"verdict":"RESTART_REQUIRED","material_blockers":[{"summary":"The authenticated FastAPI boundary retains the bearer capability and admitted source bytes in traceback-frame locals and preserves the caught domain exception as context, violating the frozen sanitization contract.","evidence":["packet.md:59-65 requires public-adapter boundaries to release sensitive scopes and arguments, raise a fresh exception with no cause or context, and make raw sensitive bytes unreachable through traceback frames or capture-locals formatting.","product/src/glupta_agi/api.py:48-85 keeps `authorization`, secret-bearing `settings`, `canonical`, and the content-bearing `payload` in `evidence_brief` while raising `HTTPException` inside the `BriefGenerationError` and `AmbiguousEffectError` handlers. `raise ... from None` suppresses display of context but does not clear `__context__`.","A read-only in-memory probe against clean exact product commit 2d98aeab01f5a1391a04bc65854b54072595dc86 exercised the real `evidence_brief` boundary with synthetic markers. The resulting `HTTPException` had `BriefGenerationError` as `__context__`, and its production traceback frame exposed both the synthetic authorization marker and admitted-source marker.","product/tests/test_api.py:18-91 exercises only successful admission and contains no failure-path assertion covering exception context, traceback locals, bearer material, or admitted source bytes."],"defect_class":"Production-code confidentiality and public exception-boundary defect","disposition":"Keep dispatch and release frozen. Add a sanitized public-adapter boundary that copies only safe error fields, exits the caught-exception scope, releases authorization/settings/request/payload objects, and raises a context-free exception; add capture-locals regressions, freeze a new tuple and hashes, and restart independent review."}],"non_blocking_findings":["The packet, manifest, and schema top-level SHA-256 values match exactly.","All 76 manifest entries resolve from the specified Git commits and match their SHA-256 values; none are missing, malformed, duplicated, or rooted incorrectly.","The named R9 bases are ancestors of the R10 candidates, and Git confirms the packet's asserted R10 changed-path sets.","The independent provider, account, release, deployment, and dispatch gates remain preserved and effective; those open gates are not themselves blockers."],"factual_corrections":["The R10 settings regressions do not establish the packet-wide public-adapter sanitization requirement; the committed API test covers only the success path.","Using `raise HTTPException(...) from None` inside an active `except` block suppresses contextual rendering but does not produce the contractually required exception with `__context__ is None`."],"foundation_disposition":{"action":"repair","cost":"Small bounded production-boundary repair plus focused regressions and a completely new frozen-candidate review.","risk":"High confidentiality impact if ASGI instrumentation or error capture retains traceback locals: bearer capability and selected source contents remain reachable. Dispatch holding currently prevents provider release but does not make the exact candidate conformant.","rollback":"R10 is not deployed, so no production rollback is required. Preserve these bytes as rejected history and supersede them only with a newly hashed candidate.","dispatch_held":true},"confidence_and_uncertainty":"High confidence. The defect follows directly from exact committed source and was reproduced in memory with synthetic values, without files, credentials, network access, mutation, or peer-review input. Review terminated at the required production-defect hard gate; no claim is made that additional blockers are absent."}